{
  "id": "faction.pirates.prototype",
  "kind": "rts_faction",
  "displayName": "Pirates",
  "playerVisibility": "diegetic_known_facts_only",
  "economy": {
    "resourceIds": ["resource.provisions", "resource.coin", "resource.salvage", "resource.favor"],
    "incomeModel": "workers_and_sites",
    "upkeepEnabled": true,
    "storageLimited": true
  },
  "buildCycle": {
    "constructionQueues": 2,
    "productionQueues": 2,
    "reservesCosts": true,
    "requiresLegalFootprint": true,
    "catalogueIds": ["site_archetype.pirates.tide_quay", "site_archetype.pirates.rum_market"]
  },
  "doctrine": {
    "goal": "Keep profitable anchorages open, seize exposed cargo and weak ports, and survive by shifting allegiance before stronger powers can contain the fleet.",
    "positionResponses": ["expand", "pursue_victory", "consolidate", "migrate", "negotiate", "raid_for_resources", "escape", "revenge"],
    "wobbleMaximum": 0.14,
    "dispatchScoreTerms": ["goal_progress", "target_threat", "faction_hatred", "trade_opportunity", "expected_loot", "strategic_position", "supply_cost", "travel_risk", "home_defense_deficit", "role_fitness"]
  },
  "elimination": {
    "persistent": true,
    "recoveryConditions": ["operational_anchorage_survives", "recoverable_named_captain_survives", "allied_restoration_route_exists"],
    "formerHoldingTransitions": ["abandoned", "captured", "dismantled", "contested", "corrupted", "reclaimed"],
    "questPolicy": "successor_recovery_or_honest_closure"
  },
  "metadata": {"implementationOwner": "rust-simulation", "maturity": "contract-fixture", "releaseLegal": true, "properNameStatus": "not_authored"}
}
