{
  "id": "faction.colonial_powers.prototype",
  "kind": "rts_faction",
  "displayName": "Colonial Powers",
  "playerVisibility": "diegetic_known_facts_only",
  "economy": {
    "resourceIds": ["resource.provisions", "resource.timber", "resource.iron"],
    "incomeModel": "workers_and_sites",
    "upkeepEnabled": true,
    "storageLimited": true
  },
  "buildCycle": {
    "constructionQueues": 1,
    "productionQueues": 2,
    "reservesCosts": true,
    "requiresLegalFootprint": true,
    "catalogueIds": ["site_archetype.colonial.watch_fort"]
  },
  "doctrine": {
    "goal": "Secure a supplied foothold, control defensible routes, and survive long enough to claim imperial authority over profitable territory.",
    "positionResponses": ["expand", "pursue_victory", "consolidate", "negotiate", "raid_for_resources", "escape"],
    "wobbleMaximum": 0.1,
    "dispatchScoreTerms": ["goal_progress", "target_threat", "faction_hatred", "trade_opportunity", "expected_loot", "strategic_position", "supply_cost", "travel_risk", "home_defense_deficit", "role_fitness"]
  },
  "elimination": {
    "persistent": true,
    "recoveryConditions": ["supplied_port_survives", "recoverable_named_commander_survives", "allied_restoration_route_exists"],
    "formerHoldingTransitions": ["abandoned", "captured", "dismantled", "contested", "corrupted", "reclaimed"],
    "questPolicy": "successor_recovery_or_honest_closure"
  },
  "metadata": {"implementationOwner": "rust-simulation", "maturity": "contract-fixture", "releaseLegal": true, "properNameStatus": "not_authored"}
}
