{
  "id": "faction.cthulhu.prototype",
  "kind": "rts_faction",
  "displayName": "Cthulhu Faction",
  "playerVisibility": "diegetic_known_facts_only",
  "economy": {
    "resourceIds": ["resource.ritual_control", "resource.dreams", "resource.corruption"],
    "incomeModel": "ritual_network",
    "upkeepEnabled": true,
    "storageLimited": true
  },
  "buildCycle": {
    "constructionQueues": 1,
    "productionQueues": 1,
    "reservesCosts": true,
    "requiresLegalFootprint": true,
    "catalogueIds": ["site_archetype.cthulhu.drowned_shrine"]
  },
  "doctrine": {
    "goal": "Control enough ritual infrastructure and island pressure to complete the Day-100 summoning plan.",
    "positionResponses": ["expand", "consolidate", "raid_for_resources", "advance_day_100_plan", "last_objective"],
    "wobbleMaximum": 0.08,
    "unattendedOutcomeBias": "eventual_victory",
    "authoredAdvantagePolicy": "prerequisite_gated_state_transaction_with_diegetic_consequence",
    "dispatchScoreTerms": ["goal_progress", "target_threat", "faction_hatred", "ritual_opportunity", "expected_loot", "strategic_position", "supply_cost", "travel_risk", "home_defense_deficit", "role_fitness"]
  },
  "elimination": {
    "persistent": true,
    "recoveryConditions": ["ritual_network_anchor_survives", "recoverable_named_herald_survives", "allied_restoration_route_exists"],
    "formerHoldingTransitions": ["abandoned", "captured", "dismantled", "contested", "corrupted", "reclaimed"],
    "questPolicy": "successor_recovery_or_honest_closure"
  },
  "metadata": {"implementationOwner": "rust-simulation", "maturity": "contract-fixture", "releaseLegal": true, "properNameStatus": "not_authored"}
}
