{
  "id": "faction.eastern_fox_people.prototype",
  "kind": "rts_faction",
  "displayName": "Eastern Fox People",
  "playerVisibility": "diegetic_known_facts_only",
  "economy": {
    "resourceIds": ["resource.rice", "resource.silk", "resource.jade", "resource.prestige"],
    "incomeModel": "workers_and_sites",
    "upkeepEnabled": true,
    "storageLimited": true
  },
  "buildCycle": {
    "constructionQueues": 2,
    "productionQueues": 2,
    "reservesCosts": true,
    "requiresLegalFootprint": true,
    "catalogueIds": ["site_archetype.eastern_fox_people.river_market", "site_archetype.eastern_fox_people.cloud_watch"]
  },
  "doctrine": {
    "goal": "Join rich waterways into a defensible trade network, preserve court prestige, and defeat threats through mobility, information, and precisely chosen force.",
    "positionResponses": ["expand", "pursue_victory", "consolidate", "migrate", "negotiate", "raid_for_resources", "accept_dependency", "revenge"],
    "wobbleMaximum": 0.09,
    "dispatchScoreTerms": ["goal_progress", "target_threat", "faction_hatred", "trade_opportunity", "expected_loot", "strategic_position", "supply_cost", "travel_risk", "home_defense_deficit", "role_fitness"]
  },
  "elimination": {
    "persistent": true,
    "recoveryConditions": ["recognized_court_seat_survives", "recoverable_named_magistrate_survives", "allied_restoration_route_exists"],
    "formerHoldingTransitions": ["abandoned", "captured", "dismantled", "contested", "corrupted", "reclaimed"],
    "questPolicy": "successor_recovery_or_honest_closure"
  },
  "metadata": {"implementationOwner": "rust-simulation", "maturity": "contract-fixture", "releaseLegal": true, "visualFamily": "eastern_wushu_fantasy_fox_people", "properNameStatus": "not_authored"}
}
